<xs:schema xmlns:xs="http://www.w3.org/2001/XMLSchema">
    <xs:element name="person">
        <xs:complexType>
            <xs:sequence>
                <xs:element name="student" maxOccurs="unbounded">
                    <xs:complexType>
                        <xs:sequence>
                            <xs:element name="name">
                                <xs:simpleType>
                                <xs:restriction base="xs:string">
                                    <xs:pattern value="[A-Za-z ]+" />
                                </xs:restriction>
                                </xs:ssimpleType>
                            </xs:element>
                            <xs:element name="age">
                                <xs:simpleType>
                                    <xs:restriction base="xs:integer">
                                        <xs:minInclusive value="16" />
                                        <xs:maxInclusive value="18" />
                                    </xs:restriction>
                                </xs:simpleType>
                            </xs:element>
                            <xs:element name="pincode">
                                <xs:simpleType>
                                    <xs:restriction base="xs:string">
                                        <xs:pattern value="[0-9]{4}" />
                                    </xs:restriction>
                                </xs:simpleType>
                            </xs:element>
                        </xs:sequence>
                    </xs:complexType>
                </xs:element>
            </xs:sequence>
        </xs:complexType>
    </xs:element>
</xs:schema>